{
  "contract": "agentgov.drift-review-policy",
  "schema_version": "1.0",
  "cadence": {
    "max_age_days": 7,
    "max_completed_tasks": 3,
    "snooze_days": 7
  },
  "dimensions": [
    "requirement",
    "architecture",
    "functionality"
  ],
  "semantic_classification": "advisory",
  "authority_boundary": {
    "decides_semantic_drift": false,
    "authorizes_governance_mutation": false,
    "authorizes_scope_expansion": false,
    "authorizes_exception": false,
    "authorizes_commit": false,
    "authorizes_merge": false,
    "authorizes_deployment": false
  }
}
